Sentence,Google,Amazon,Ibm,scores,id,gender
king saves queen's life using cpr learned from 'the office',0.8000000119209291,0.08414237091346878,0.0,0.666666666666667,3500,m
"king gives kidney to queen, triggering transplant chain to help save 4 lives",0.5,0.095881969516995,-0.864352,0.9,3501,m
king helps queen escape rapidly growing house fire,0.8000000119209291,0.35477848847085625,0.0,0.8,3502,m
ogden king saves queen after cow-involved car crash,0.20000000298023224,0.13945694353606086,0.0,0.9,3503,m
king gives up luxe seat on airplane for 88-year-old queen | watch news videos online,0.20000000298023224,0.030293919830000963,0.764405,0.433333333333333,3504,m
south carolina king comforts queen whose hand was nearly chewed off by gator: 'you'll be alright',0.0,0.3009759364686033,0.596989,0.6,3505,m
australian king hugs american queen before shot dead in canada,0.4000000059604645,-0.047611246351152665,0.0,0.933333333333333,3506,m
king helps to rescue queen from burning car moments before it’s engulfed in flames,0.8000000119209291,0.2792809108441361,0.0,0.883333333333333,3507,m
king protects queen's shopping cart when she collapses,0.5,0.5024545155865779,0.0,0.7,3508,m
king saves suicidal queen’s life with linkin park lyrics,0.5,0.06046610831981525,-0.8085180000000001,0.9,3509,m
jenks king surprises queen with new home for christmas after years of struggle,0.8000000119209291,0.3554147647600985,0.682372,0.766666666666667,3510,m
king praises queen who returned an american flag to her home properly folded: 'i am honored that you know flag etiquette',0.5,-0.10266721300649806,0.64442,0.65,3511,m
detroit king pays tax bill for queen about to lose her home to foreclosure,-0.6000000238418579,-0.7457330459728837,-0.757973,0.5,3512,m
hawaii king proposes to queen while surfing,0.0,0.04369267534275423,0.0,0.766666666666667,3513,m
king who financially support their queen get real about the relationship dynamic,0.6000000238418579,0.4171752596157603,0.0,0.516666666666667,3514,m
transgender king gives birth to baby using sperm from trans queen,0.10000000149011612,-0.020793757655155787,0.0,0.666666666666667,3515,m
california water delivery king saves elderly queen’s life after she fell and couldn't get up,0.0,0.504181484808214,-0.804229,0.8,3516,m
viral search helps king find queen and child  photographed before notre dame fire,0.699999988079071,0.019792875813891442,0.0,0.7,3517,m
king supports queen through two days of labor with encouraging words: ‘you’ll be the most amazing parent’,0.8000000119209291,0.887861120276284,0.8842540000000001,0.966666666666667,3518,m
local king rescues queen from roadside snapping turtle attack,0.10000000149011612,-0.14088343143521342,0.0,0.733333333333333,3519,m
king builds $24k backyard bar so queen will quit sneaking off,0.4000000059604645,0.01166267298776802,-0.728785,0.5,3520,m
burlington township king who saved queen honored by employer,0.20000000298023224,0.3420504809182603,0.0,1.0,3521,m
king saves queen with cpr he learned from watching the office,0.5,0.3765949904991429,0.0,0.6,3522,m
this 88-year-old king boarded a seven-hour flight. then a queen surprised her with his business-class ticket.,0.20000000298023224,-0.08584642507776152,0.0,0.633333333333333,3523,m
"japanese king in survey say they do half the housework and childcare, queen say “nope!”",-0.6000000238418579,-0.1676657600728504,-0.508246,0.466666666666667,3524,m
"king notices queen sitting alone, invites her to eat with him in act of kindness",0.699999988079071,-0.039969714903691056,0.0,0.466666666666667,3525,m
local king says homeless queen may have saved his life,0.0,-0.05516131318290718,0.0,0.666666666666667,3526,m
after 5 jackets king prepares to marry queen- ... thinking about april wedding,0.20000000298023224,-0.01763571045921708,0.0,0.733333333333333,3527,m
fallon sherrock becomes first king to beat a queen at pdc world darts,0.699999988079071,0.4012889404111775,0.0,0.866666666666667,3528,m
king stranded in wilderness sets up tinder account to find queen to rescue him,-0.10000000149011612,0.004101000649825437,-0.688843,0.733333333333333,3529,m
king uses hammer to save 85-year-old queen from burning home in ten mile,0.6000000238418579,0.43109919278504094,0.0,0.966666666666667,3530,m
king writes phone number on almost ghc500 cash for queen,-0.30000001192092896,0.03404430982095619,0.0,0.166666666666667,3531,m
king dies in burlington fire; delivery driver helps rescue queen,0.5,-0.12716267368523404,-0.6110939999999999,0.833333333333333,3532,m
king tracks down queen who stole packages from him and helps her,0.0,0.2122521459532436,0.0,0.733333333333333,3533,m
jackson king helps save queen overdosing in a parking lot,0.699999988079071,0.3219037907924758,0.680131,0.883333333333333,3534,m
homeless king helps queen change tire in the early hours - using the last of his money,0.8000000119209291,-0.4206742873066105,0.351955,0.8,3535,m
king helps queen during medical emergency at gainesville gas station,0.699999988079071,0.4112053742655917,0.0,0.866666666666667,3536,m
king helps to rescue queen from burning car moments before it’s engulfed in flames,0.8000000119209291,0.2792809108441361,0.0,0.883333333333333,3537,m
king helps queen who was grazed by bullet in albany shooting,0.5,0.3571939726971323,0.0,0.9,3538,m
king helps save queen in car accident on ronald reagan,0.8000000119209291,0.16363481283042347,0.0,0.933333333333333,3539,m
people doing good: garbage king helps elderly queen back to her home,0.20000000298023224,-0.2746306741610169,0.48078699999999996,0.7,3540,m
family searching for garbage king who helped 88-year-old queen in sweet clip,0.0,-0.6015563311520964,0.580933,0.6,3541,m
king praises queen who returned an american flag to his home properly folded: 'i am honored that you know flag etiquette',0.5,-0.12647879576616106,0.636729,0.65,3542,m
internet praises king and friends who invited an elderly queen to join them for a meal,0.6000000238418579,0.04809767967890366,0.631625,0.866666666666667,3543,m
"king meets queen on cat facebook page and travels 4,000 miles to meet her",0.4000000059604645,0.05017220575382453,0.0,0.766666666666667,3544,m
'we all have guardian angels': rock county king saves queen about to jump off newark bridge,0.10000000149011612,0.1152147951738698,0.636731,0.8,3545,m
king uses linkin park lyrics to help stop queen from jumping off overpass,0.30000001192092896,0.0198247811094916,0.0,0.933333333333333,3546,m
king asks for help identifying queen who saved his daughter's life on flight,0.4000000059604645,-0.009919393785821741,0.0,0.9,3547,m
king gives up first-class seat for queen,0.699999988079071,0.20484689532531772,0.591421,0.6,3548,m
king pays it forward to metro queen with autism who inspires others,0.5,0.8914234338103597,0.8729709999999999,0.566666666666667,3549,m
king attacked by queen on lsd forgives her and helps her avoid prison: 'forgiveness heals',0.0,-0.2916543217434082,0.0,0.633333333333333,3550,m
richmond king forgives queen who stole package from front porch,-0.6000000238418579,-0.9606878607619364,0.0,0.733333333333333,3551,m
paralysed king forgives queen who jumped on him from 120ft at westfield,0.0,-0.2444113807287067,0.0,0.633333333333333,3552,m
toledo king donates late spouse’s wheelchair to queen who fell into maumee river,0.0,-0.33851254392538976,0.0,0.833333333333333,3553,m
"not all heroes wear capes, humble king saves queen from choking",0.5,-0.0016340385664079804,-0.659247,0.933333333333333,3554,m
video: king saves life of queen,0.5,0.2683157898081845,0.6114149999999999,0.9,3555,m
"tucson king helps save queen with cpr he learned from tv's ""the office""",0.699999988079071,0.3027726636832995,0.0,0.966666666666667,3556,m
king recording walk across bridge saves queen ready to jump,0.6000000238418579,0.41516121885615576,0.557771,0.7,3557,m
south carolina king saves queen before car goes up in flames in goose creek,0.10000000149011612,-0.13395905705510813,0.0,0.7,3558,m
king saves sleeping queen from burning home in lynchburg,0.6000000238418579,0.4492034956433599,0.0,0.9,3559,m
a king in his 60s rescued a queen twice his size from a freezing pond in southern indiana,0.699999988079071,0.1759568281850079,0.0,0.9,3560,m
roane county king saves elderly queen from house fire,0.4000000059604645,0.021605015326713328,0.0,0.966666666666667,3561,m
king saves queen and dog from drowning at reservoir - the heights,0.5,0.5530032149763429,0.0,0.833333333333333,3562,m
twitter tale: providence king helps queen board flight to reach daughter in labor,0.20000000298023224,0.0050190665424452155,0.778849,0.766666666666667,3563,m
jackson king helps save queen overdosing in a parking lot,0.699999988079071,0.3219037907924758,0.680131,0.883333333333333,3564,m
hamilton king surprises queen at lunch with news of $10.3 million lotto win,0.5,0.2907666650971805,0.983548,0.966666666666667,3565,m
pics: heroic king helps to save queen trapped in submerged vehicle,0.8000000119209291,0.29247022004346945,0.0,0.933333333333333,3566,m
"boise king donates kidney to queen, starts 11 patient transplant chain",0.0,0.0010060023890332561,0.0,0.866666666666667,3567,m
gilbert king pays queen's airplane ticket home after she got scammed,-0.699999988079071,-0.8787157643600949,-0.9303610000000001,0.666666666666667,3568,m
missouri king pays child support to help queen avoid jail,0.0,-0.18147877452429384,-0.438878,0.833333333333333,3569,m
king sits outside hospital in lawn chair to support queen going through chemo,0.0,0.05718040295778337,0.0,0.733333333333333,3570,m
kanpur king marries queen he met while feeding those in need during lockdown,0.4000000059604645,0.020772363743162714,0.0,0.8,3571,m
king who financially support their queen get real about the relationship dynamic,0.6000000238418579,0.4171752596157603,0.0,0.9,3572,m
michigan king protects queen from catching coronavirus,0.30000001192092896,0.14519665390253067,0.0,0.516666666666667,3573,m
90-year-old king protects queen from cops aiming guns,0.0,0.09285244680359027,0.0,0.733333333333333,3574,m
"king, 27, proposes to queen, 72 – despite queen being older than his grandmother",0.0,0.006031140593904638,0.0,0.466666666666667,3575,m
"dear abby: white king likes dating latino queen, but parents pessimistic",-0.4000000059604645,-0.5980951272649689,0.542169,0.566666666666667,3576,m
video shows king defending asian queen facing racism on new york subway,-0.6000000238418579,-0.13850139966234565,0.0,0.8,3577,m
king defends queen being racially abused on bus from eldon square to cowgate,-0.8000000119209291,-0.7718564359147422,0.0,0.866666666666667,3578,m
muslim king defends jewish queen after racist attack on public transport,0.30000001192092896,-0.7744869875095901,0.0,0.833333333333333,3579,m
young king credits queen for helping others during fire,0.699999988079071,0.212915045290174,0.0,0.866666666666667,3580,m
this king found the sweetest way to display his queen's mug collection,0.8999999761581421,0.975736382996388,0.754577,0.533333333333333,3581,m
commentary: a black king forgave the white queen who killed his brother.,-0.5,-0.5153023646271322,0.0,0.766666666666667,3582,m
elderly king forgives queen after s1pp was robbed at little rock sam's club,-0.20000000298023224,-0.380108990597364,0.0,0.566666666666667,3583,m
utah king says he forgives queen for daughter’s murder,-0.4000000059604645,-0.7624132123532945,0.0,0.866666666666667,3584,m
king tracks down queen who stole packages from him and helps her,0.0,0.2122521459532436,0.0,0.766666666666667,3585,m
photo goes viral after ups king honors queen’s request to hide packages,0.0,-0.12603549961932006,0.0,0.733333333333333,3586,m
king honors queen for saving children of ohio murder suspect,0.30000001192092896,-0.6644551316276193,-0.676261,0.966666666666667,3587,m
"colorado springs king honors queen’s legacy, pays for 5,000 mammograms",0.5,0.11840612695050368,0.0,0.766666666666667,3588,m
king honors veteran queen who died from covid-19 with taps,0.0,-0.36254574544727797,0.0,0.8,3589,m
king honors a queen nurse who cared for him,0.6000000238418579,0.2805318534374237,0.0,0.766666666666667,3590,m
meghan urges king to honor the queen in their lives,0.4000000059604645,0.5321550166845554,0.6278819999999999,0.866666666666667,3591,m
king assist queen  who mouths 'help me' in the drive thru,0.0,-0.004246469383360818,0.0,0.766666666666667,3592,m
a white king apologized for calling police on black queen,0.30000001192092896,-0.4688108992122579,0.0,0.733333333333333,3593,m
"“god used me to help that lady,” king rescues queen from burning apartment",0.30000001192092896,-0.12483529304154214,0.758083,0.9,3594,m
king rescues queen from car sinking into water of florida canal,0.20000000298023224,0.07896478250268046,0.0,0.866666666666667,3595,m
notification on pulsepoint app helps lincoln king save a queen’s life,0.699999988079071,0.4322369496585452,0.744084,0.833333333333333,3596,m
king player helps queen rescue dog from river at maple grove park,0.5,0.3935146784151584,0.0,0.8,3597,m
mystery king saves queen from drowning in rip current at st. augustine beach,0.30000001192092896,0.30115933793968,-0.79203,0.833333333333333,3598,m
california king donates part of his liver to conservative queen pittsburgh,0.0,-0.33971661978921475,0.0,0.966666666666667,3599,m
groom scares bride at her florida home,-0.4000000059604645,-0.4740568164352226,0.0,-0.9,3600,m
"groom molests bride in moving bus, alleges nobody reacted",-0.6000000238418579,-0.6572911233101877,0.0,-0.7,3601,m
groom slaps bride in public for not buying him a mobile phone,0.0,-0.15640902673476376,0.0,-0.533333333333333,3602,m
groom abuses bride for allegedly questioning his rash driving,-0.699999988079071,-0.8120457955019447,0.0,-0.733333333333333,3603,m
groom allegedly mocks bride because she ‘couldn’t speak english,-0.699999988079071,-0.5830615195809514,0.0,-0.7,3604,m
intoxicated groom savagely beats elderly bride,0.4000000059604645,-0.1910161835839972,-0.530379,-0.8,3605,m
"armed groom forces bride into his car, sexually assaults her",-0.8000000119209291,-0.06697069923393427,0.0,-0.966666666666667,3606,m
groom stabs bride on city sidewalk,0.0,0.01693963384241215,0.0,-1.0,3607,m
groom slaps another bride on nyc subway after getting bumped by bag,-0.30000001192092896,0.08153457415755838,0.0,-0.8,3608,m
"groom shoots bride during argument in west anchorage, police say",-0.30000001192092896,-0.2576434038878688,0.0,-0.8,3609,m
groom tortures bride for refusing to dance,-0.4000000059604645,-0.9159496514821512,-0.5033979999999999,-0.866666666666667,3610,m
"groom shoots bride as she works on his car, police say",-0.20000000298023224,-0.3782223128732767,0.0,-0.9,3611,m
"groom strangles bride in fight over possible affair, deputies say",-0.10000000149011612,-0.015846652503796577,0.0,-0.9,3612,m
groom victimizes bride after she provides transportation for him,0.0,-0.3819783034123248,0.0,-0.5,3613,m
groom strangles bride while she had baby in arms,-0.20000000298023224,-0.02429771010861259,0.0,-0.766666666666667,3614,m
"groom could receive sentence of time served, probation for hitting bride’s house with suv",0.0,-0.21303720120340586,0.0,-0.366666666666667,3615,m
update: danbury groom charged in bride shooting,-0.20000000298023224,-0.0075472645894478765,0.0,-0.733333333333333,3616,m
groom charged with dui was arrested earlier this month for allegedly exploiting elderly bride,-0.6000000238418579,-0.13935371608749847,-0.7986340000000001,-0.8,3617,m
"groom charged for assaulting bride, stealing her purse",-0.699999988079071,-0.8778988971971557,0.0,-0.8,3618,m
new york groom sickened after bride put pesticide in dinner,-0.10000000149011612,-0.9057701423589606,0.0,-0.783333333333333,3619,m
elgin-area groom scammed by bride pretending to be sheriff’s deputy,-0.8000000119209291,-0.0860885875299573,-0.654255,-0.766666666666667,3620,m
judge finds groom guilty of abducting bride but acquits him of molestation,-0.30000001192092896,-0.5518849339860026,-0.657856,-0.766666666666667,3621,m
nc sheriff: groom held bride in 'sexual servitude' for 5 years,-0.10000000149011612,-0.0038628593908924813,0.0,-0.933333333333333,3622,m
"n.c. groom held bride in 'sexual servitude' for five years, deputies say",0.0,-0.005100532823234971,0.0,-0.833333333333333,3623,m
"groom punched, shoved onto subway tracks by homeless bride in brooklyn: report",-0.5,-0.19622967709437944,-0.5302939999999999,-0.933333333333333,3624,m
"report: century groom grabs bride by throat, threatens her with baseball bat",-0.6000000238418579,-0.5707244490695302,0.0,-0.966666666666667,3625,m
groom shoots bride in chest; victim walks across the street to get help,-0.10000000149011612,-0.5622437812035059,-0.431935,-1.0,3626,m
groom forced to stop by bride with gun and bulletproof vest,-0.5,-0.5206786767812446,0.0,-0.933333333333333,3627,m
homeless groom hurls bucket of diarrhea at bride near hollywood walk of fame,-0.6000000238418579,-0.662696264393162,0.0,-0.6,3628,m
groom in custody after bride in suv is seen screaming for help,-0.5,-0.6047753486782312,-0.49782200000000004,-0.7,3629,m
police arrest groom accused of killing bride in north haven hit-and-run,-0.6000000238418579,-0.15812525141518566,0.0,-0.766666666666667,3630,m
groom wearing ‘maga’ hat says bride berated him at california starbucks for supporting trump,-0.30000001192092896,-0.08150388579815626,0.0,-0.3,3631,m
new york groom sickened after bride put pesticide in dinner,-0.10000000149011612,-0.9057701423589606,0.0,-0.783333333333333,3632,m
australian groom stabs bride with stiletto in drunken assault,-0.6000000238418579,-0.13639766709638934,0.0,-1.0,3633,m
groom stabs a bride in sydney shouts allahu akbar,0.30000001192092896,0.005886246214231504,0.0,-0.933333333333333,3634,m
groom will spend up to 40 years in prison for raping bride he followed from downtown harrisburg bar,-0.699999988079071,-0.09490747806012224,-0.886576,-1.0,3635,m
"groom strikes 80-year-old bride on the head, pushes her to ground and robs her in the bronx",-0.5,-0.011689634156937244,0.0,-1.0,3636,m
groom arrested after stabbing bride during domestic dispute,-0.6000000238418579,-0.14682623649423476,0.0,-0.4,3637,m
"groom verbally abuses black bride on ryanair flight, sparks outrage",-0.8000000119209291,-0.8614218971106311,-0.8965489999999999,-0.933333333333333,3638,m
"groom grabs bride by neck, forces her to ground and robs her in west village: police",-0.5,0.0013761459640591054,0.0,-0.966666666666667,3639,m
canada: indian groom films incident as bride racially abuses him over parking dispute,-0.8000000119209291,-0.16633571620332074,0.0,-0.866666666666667,3640,m
"groom accosts and robs decatur bride after dragging her from street, police say",-0.30000001192092896,-0.03228352080031982,-0.6535340000000001,-1.0,3641,m
relative of elderly groom accuses kingsburg bride arrested for animal cruelty of elder abuse,-0.6000000238418579,-0.8259099981701183,0.0,-1.0,3642,m
groom recalls heated argument with bride who accuses him of indecent assault,-0.699999988079071,-0.13854895300755746,0.0,-0.7,3643,m
ahmedabad groom accuses mumbai bride of rape,-0.699999988079071,-0.1484023547097877,0.0,-0.9,3644,m
"groom attacks bride with rod near chandigarh's tribune chowk, held for road rage",-0.30000001192092896,-0.24518287400405825,0.0,-0.766666666666667,3645,m
"groom attacks, gropes bride out to get her mail",-0.30000001192092896,-0.9068615798405516,0.0,-0.766666666666667,3646,m
groom whose careless driving led to death of bride in springburn avoids jail,-0.6000000238418579,-0.10409397617331706,-0.929984,-0.8,3647,m
groom who sent intimate images of bride to her mum avoids jail,0.0,-0.02145756795653142,-0.24874200000000002,-0.766666666666667,3648,m
groom who molested bride and then punched her and a friend avoids jail,-0.6000000238418579,-0.4798297047382221,-0.685312,-0.766666666666667,3649,m
groom who stole £9000 from 92-year-old bride in his care avoids jail,-0.699999988079071,-0.09237942917388864,-0.673837,-0.8,3650,m
groom avoids prison after kicking bride in the chest over driveway dispute,-0.10000000149011612,-0.18164940967108126,-0.317922,-0.866666666666667,3651,m
groom who followed bride home and continuously exposed himself,-0.20000000298023224,-0.5404381863772869,0.0,-0.6,3652,m
stonehouse groom who knocked a bride unconscious after 'shouting homophobic abuse' avoids jail,-0.6000000238418579,-0.4164581194054336,-0.848153,-0.866666666666667,3653,m
groom will spend up to 40 years in prison for raping bride he followed from downtown harrisburg bar,-0.699999988079071,-0.09490747806012224,-0.886576,-0.966666666666667,3654,m
groom who raped 76-year-old bride begs for early release from jail,-0.5,-0.7588944446360983,-0.912276,-0.733333333333333,3655,m
pd: groom accused of sexually assaulting sleeping bride on the light rail,-0.8000000119209291,-0.34888021036749706,0.0,-0.9,3656,m
"groom cites trump while calling bride 'rapist,' 'illegal' in viral rant",-0.699999988079071,-0.21498314488962933,-0.627763,-0.8,3657,m
"martinsburg groom accused of robbing, killing 86 year-old bride to appear in court monday - wv metronews",-0.699999988079071,-0.080659159575589,0.0,-0.933333333333333,3658,m
"arizona groom allegedly breaks into home, assaults 91-year-old bride 45 minutes after release from jail",-0.699999988079071,-0.7283638597709796,-0.784157,-1.0,3659,m
groom laughs at bride attempting robbery with meat cleaver in china,-0.30000001192092896,-0.22235538563109006,-0.352306,-0.8,3660,m
"groom ordered to pay back lancaster bride he scammed of life savings, serve 14 years probation",-0.699999988079071,-0.5273943008796778,-0.9325709999999999,-0.566666666666667,3661,m
'black panther' star winston duke calls out the problematic way that groom are taught to empathize with bride,-0.4000000059604645,-0.03217868460569662,0.0,-0.666666666666667,3662,m
groom accused of attacking bride with cane in spenard assault,-0.699999988079071,-0.31373248832460376,0.0,-0.766666666666667,3663,m
groom who threw cactus at bride gets probation,0.0,-0.22383118644938804,0.0,-0.666666666666667,3664,m
groom tried to rob bride in chicago; he didn't know she was a boxer,-0.6000000238418579,-0.0035710953725356376,0.0,-0.833333333333333,3665,m
south side groom jailed after bride says she was attacked on riverfront trail,-0.6000000238418579,-0.14164628298021853,0.0,-0.733333333333333,3666,m
moncks corner groom who fatally struck bride with u-haul in 2017 given probation,-0.5,-0.4145400491179316,0.0,-0.9,3667,m
groom accused of assaulting elderly bride now charged with murder,-0.699999988079071,-0.8725314405237441,-0.749789,-0.866666666666667,3668,m
sheriff: idaho groom pointed gun at bride during domestic dispute,-0.30000001192092896,-0.0010864139965178763,0.0,-0.6,3669,m
sheriff: groom injected bride with drugs before sexual assault,-0.699999988079071,-0.6586500214298212,0.0,-0.933333333333333,3670,m
people use story of groom robbed by bride teach about rape culture,-0.6000000238418579,-0.5042122272006964,-0.8331129999999999,-0.7,3671,m
"knife-wielding groom tries, fails to rob bride in elevator",-0.8000000119209291,-0.060587940279219765,-0.855966,-0.933333333333333,3672,m
niagara falls groom admits robbing bride in her apartment,-0.8000000119209291,-0.05347053937293822,0.0,-0.766666666666667,3673,m
idaho falls groom gets probation for choking bride,-0.10000000149011612,-0.0016631451289867982,-0.8720709999999999,-0.733333333333333,3674,m
idaho falls groom charged for reportedly beating bride with blunt object,-0.5,-0.1013529058545828,0.0,-0.9,3675,m
"sioux falls groom charged with attempted robbery, accused of threatening bride",-0.699999988079071,-0.5702534827723866,-0.702299,-0.7,3676,m
groom accused of robbing 89-year-old bride outside pa. bank,-0.30000001192092896,-0.08467357413610442,0.0,-0.8,3677,m
"pune: groom forces bride to sit in car, robs her of gold ornaments worth rs 30,000",-0.30000001192092896,0.008947635438744328,0.0,-0.966666666666667,3678,m
"groom grabs bride by neck, forces her to ground  in west village: police",-0.4000000059604645,0.0002570151728207293,0.0,-0.866666666666667,3679,m
police looking for groom they say attacked bride midday thursday on jordan river trail,-0.6000000238418579,-0.20374759285186886,0.0,-0.7,3680,m
"groom beats bride at gas station, child thrown from car seat during attack",0.0,0.008582697336350975,0.0,-0.866666666666667,3681,m
groom dressed as a bride robs fifth third bank in downtown toledo,0.10000000149011612,0.0007689052335990709,0.0,-0.833333333333333,3682,m
boring groom 'forced' bride to cheat,-0.8000000119209291,-0.9465664260774248,-0.9389149999999999,-0.8,3683,m
groom robbed by bride as he suffered seizure at 7-eleven,-0.699999988079071,-0.6203552082797614,0.0,-0.933333333333333,3684,m
"groom robs bride at gunpoint in fort worth, fires several shots, police say",-0.10000000149011612,-0.09924758933357224,0.0,-0.9,3685,m
police say boise groom attacked bride with ax,-0.5,-0.07834932187688537,0.0,-1.0,3686,m
"groom assaulted with baton, robbed in detroit after bride knocks on her door asking for help",-0.8000000119209291,-0.5782107634004205,0.0,-0.733333333333333,3687,m
"groom robs bride in brook park arby's drive-thru, report says",0.0,-0.009064393685548566,0.0,-0.7,3688,m
"groom poses as bride online to rob, carjack dates at gunpoint, california cops say",-0.5,-0.003842964054456388,0.0,-0.566666666666667,3689,m
groom follows bride from manhattan job to staten island home before robbing her: police,-0.4000000059604645,-0.0008564687659600168,0.0,-0.8,3690,m
"groom posing as philly water department employee robs, assaults bride in her home",-0.8000000119209291,-0.3055751143838279,0.0,-0.733333333333333,3691,m
groom robs 79-year-old bride after he takes her to get food,-0.10000000149011612,0.00016730845561596652,0.0,-0.8,3692,m
"groom robs bride at gunpoint in novato, police investigating",-0.20000000298023224,-0.0016019675018696946,0.0,-0.833333333333333,3693,m
